"Rank","Title","Status","Study Results","Conditions","Interventions","Gender","Age","Phases","Enrollment","Completion Date","Locations","URL"
174,"CPAP vs.Unsynchronized NIPPV at Equal Mean Airway Pressure","Unknown status","No Results Available","Prematurity|Respiratory Distress Syndrome|Apnea of Prematurity","Other: continuous positive airway pressure|Other: nasal intermittent positive pressure ventilation","All","up to 6 Months   (Child)","Not Applicable","80","June 30, 2022","Women and Infants Hospital of Rhode Island, Providence, Rhode Island, United States","https://ClinicalTrials.gov/show/NCT03670732"
175,"Extending CPAP Therapy in Stable Preterm Infants to Increase Lung Growth and Function","Recruiting","No Results Available","Neonatal|Premature Birth|Respiratory Distress Syndrome","Other: Additional 2 weeks of CPAP","All","1 Day to 12 Weeks   (Child)","Phase 2|Phase 3","130","December 31, 2023","Doernbecher Neonatal Care Center at Oregon Health & Science University, Portland, Oregon, United States","https://ClinicalTrials.gov/show/NCT04295564"
176,"IC14 Antibodies to Treat Individuals With Acute Lung Injury","Terminated","No Results Available","Respiratory Distress Syndrome, Adult|Lung Diseases","Drug: IC14","All","18 Years to 70 Years   (Adult, Older Adult)","Phase 2","13","June 2007","University of Washington, Seattle, Washington, United States","https://ClinicalTrials.gov/show/NCT00233207"
177,"PECO Air Purification in Hospital Rooms to Improve Health Outcomes for Pediatric Respiratory Distress","Completed","No Results Available","Asthma|Pneumonia|Respiratory Distress Syndrome","Device: Photo Electrochemical Oxidation (PECO) for Air Purification","All","1 Year to 17 Years   (Child)","Not Applicable","274","December 31, 2018","Mercyhealth Hospital - Rockton Avenue, Rockford, Illinois, United States","https://ClinicalTrials.gov/show/NCT03647397"
178,"Antenatal Betamethasone Compared to Dexamethasone - ""BETACODE TRIAL""","Completed","No Results Available","Respiratory Distress Syndrome|Intraventricular Hemorrhage|Neonatal Mortality","Drug: Betamethasone(Celestone soluspan) and Dexamethasone","Female","18 Years to 45 Years   (Adult)","Not Applicable",,"April 2005","Stony Brook University Hospital, Stony Brook, New York, United States","https://ClinicalTrials.gov/show/NCT00418353"
179,"Evaluate the Safety of agenT-797 in Participants With Moderate to Severe Difficulty Breathing Secondary to SARS-CoV-2","Completed","No Results Available","Respiratory Distress Syndrome, Adult","Drug: agenT-797","All","18 Years and older   (Adult, Older Adult)","Phase 1|Phase 2","20","June 2, 2022","Saint John's Cancer Institute, Santa Monica, California, United States|Norton Cancer Institute, St. Matthews Campus, Louisville, Kentucky, United States|Weill Cornell Medicine New York Presbyterian, New York, New York, United States","https://ClinicalTrials.gov/show/NCT04582201"
180,"Feasibility and Impact of Volume Targeted Ventilation in the Delivery Room","Recruiting","No Results Available","Prematurity|BPD - Bronchopulmonary Dysplasia|Respiratory Distress Syndrome, Newborn","Device: Volume Targeted Ventilation (VTV) using the Philips Respironics NM3 monitor|Device: Tidal Volume Measurement using the Philips Respironics NM3 monitor","All","5 Minutes to 60 Minutes   (Child)","Not Applicable","40","December 31, 2023","Baystate Medical Center, Springfield, Massachusetts, United States","https://ClinicalTrials.gov/show/NCT03938532"
181,"Oscillatory Versus Non-Oscillatory Nasal Continuous Airway Pressure Neonatal Respiratory Support","Withdrawn","No Results Available","Respiratory Distress Syndrome|Prematurity","Device: Nasal CPAP|Device: Oscillatory NCPAP","All","up to 28 Days   (Child)","Not Applicable","0","April 2017","Valley Children's Healthcare, Madera, California, United States|Primary Children's Medical Center, Salt Lake City, Utah, United States|University of Utah Health Sciences Center, Salt Lake City, Utah, United States","https://ClinicalTrials.gov/show/NCT01277874"
182,"Nasal High Frequency Ventilation in Preterm Infants: A Pilot Study","Completed","Has Results","Infant Respiratory Distress Syndrome|Respiratory Insufficiency|Apnea of Prematurity","Other: Nasal high frequency ventilation","All","7 Days to 3 Months   (Child)","Phase 1","14","February 2008","Children's Hospital of Iowa NICU, Iowa City, Iowa, United States","https://ClinicalTrials.gov/show/NCT00296231"
183,"Prazosin to Prevent COVID-19 (PREVENT-COVID Trial)","Terminated","Has Results","COVID-19","Drug: Prazosin|Other: Standard of care","All","45 Years to 85 Years   (Adult, Older Adult)","Phase 2","5","March 31, 2022","Johns Hopkins Hospital, Baltimore, Maryland, United States","https://ClinicalTrials.gov/show/NCT04365257"
184,"Non-invasive Vagal Neurostimulation (nVNS) for Traumatic Brain Injury (TBI)-Induced Acute Respiratory Distress","Recruiting","No Results Available","Acute Respiratory Distress Syndrome|Acute Lung Injury|Acute Lung Injury/Acute Respiratory Distress Syndrome (ARDS)|Traumatic Brain Injury","Device: nVNS|Other: SOC","All","18 Years to 80 Years   (Adult, Older Adult)","Not Applicable","46","December 2025","AHN Allegheny General Hospital, Pittsburgh, Pennsylvania, United States","https://ClinicalTrials.gov/show/NCT04935697"
185,"REgulatory T Cell infuSion fOr Lung Injury Due to COVID-19 PnEumonia","Completed","No Results Available","COVID19|ARDS","Biological: CK0802|Drug: Placebo","All","18 Years and older   (Adult, Older Adult)","Phase 1","45","October 22, 2021","Johns Hopkins Hospital, Baltimore, Maryland, United States|Columbia University, New York, New York, United States|University of North Carolina, Chapel Hill, North Carolina, United States|Wake Forest University, Winston-Salem, North Carolina, United States|Baylor College of Medicine, St Luke's Hospital, Houston, Texas, United States","https://ClinicalTrials.gov/show/NCT04468971"
186,"Evaluation of Safety & Efficacy of BIO-11006 Inhalation Solution in Patients With ARDS","Completed","No Results Available","Respiratory Distress Syndrome, Adult","Drug: BIO-11006|Drug: Placebo","All","18 Years to 75 Years   (Adult, Older Adult)","Phase 2","38","June 15, 2020","University of Chicago Medicine, Chicago, Illinois, United States|University of North Carolina School of Medicine, Chapel Hill, North Carolina, United States|Wake Forest University, Winston-Salem, North Carolina, United States|University of Pennsylvania, Philadelphia, Pennsylvania, United States|Vanderbilt University, Div of Allergy, Pulmonary, Critical Care, Nashville, Tennessee, United States","https://ClinicalTrials.gov/show/NCT03202394"
187,"Hospital-wide Incidence, Clinical Characteristics and Outcomes of ARDS","Active, not recruiting","No Results Available","ARDS|Respiratory Failure|Lung Ultrasound","Diagnostic Test: Estimation of hospital-wide incidence of ARDS","All","18 Years and older   (Adult, Older Adult)",,"9999","October 15, 2023","Beth Israel Deaconess Medical Center, Boston, Massachusetts, United States|University Health Network, Toronto, Ontario, Canada|AOU Citta' della Salute e Della Scienza - Molinette, Torino, Italy|Ospedale San Giovanni Bosco, Torino, Italy","https://ClinicalTrials.gov/show/NCT03546699"
188,"Comparative Evaluation of Albumin and Starch Effects in Acute Lung Injury (ALI)","Terminated","Has Results","Lung Injury, Acute (ALI)|Respiratory Distress Syndrome, Acute (ARDS)","Drug: 5% human albumin|Drug: 6% hetastarch","All","18 Years and older   (Adult, Older Adult)","Phase 3","31","November 2016","Grady Memorial Hospital, Atlanta, Georgia, United States|Emory Crawford Long Hospital, Atlanta, Georgia, United States|Emory University Hospital, Atlanta, Georgia, United States|Wake Forest Baptist Medical Center, Winston-Salem, North Carolina, United States","https://ClinicalTrials.gov/show/NCT00796419"
189,"Treatment of ARDS With Instilled T3","Recruiting","No Results Available","ARDS, Human|Lung, Wet|Thyroid|Pulmonary Edema|Lung Inflammation","Drug: Liothyronine Sodium (T3) (modified formulation)","All","18 Years and older   (Adult, Older Adult)","Phase 1|Phase 2","68","October 10, 2023","Essentia Health - St. Mary's Medical Center, Duluth, Minnesota, United States|M Health Fairview Southdale Hospital, Edina, Minnesota, United States|East Bank Hospital - M Health Fairview University of Minnesota Medical Center, Minneapolis, Minnesota, United States|M Health Fairview St. Joseph's Hospital, Saint Paul, Minnesota, United States|M Health Fairview Bethesda Hospital, Saint Paul, Minnesota, United States","https://ClinicalTrials.gov/show/NCT04115514"
190,"Observational Cohort Study of Distribution of Ventilation in Pediatrics Requiring Mechanical Ventilation by Electrical Impedance Tomography","Completed","No Results Available","Respiratory Failure|Acute Respiratory Distress Syndrome|Acute Lung Injury",,"All","1 Day to 17 Years   (Child)",,"11","November 4, 2018","Boston Children's Hospital, Boston, Massachusetts, United States","https://ClinicalTrials.gov/show/NCT02247700"
191,"Forced Oscillometry in Infants With Bronchopulmonary Dysplasia","Recruiting","No Results Available","Infant, Premature, Diseases|Bronchopulmonary Dysplasia|Respiratory Distress Syndrome","Device: Non-invasive forced airway oscillometry","All","Child, Adult, Older Adult",,"70","December 2024","Children's Mercy Hospital, Kansas City, Missouri, United States","https://ClinicalTrials.gov/show/NCT04270045"
192,"LIPS-B: Lung Injury Prevention Study With Budesonide and Beta","Completed","Has Results","Acute Respiratory Distress Syndrome (ARDS)","Drug: Budesonide|Drug: Placebo|Drug: Formoterol","All","18 Years and older   (Adult, Older Adult)","Phase 2","61","December 2015","University of Arizona, Tucson, Arizona, United States|Stanford University, Stanford, California, United States|Mayo Clinic in Florida, Jacksonville, Florida, United States|Beth Israel Medical Center, Boston, Massachusetts, United States|Mayo Clinic in Rochester, Rochester, Minnesota, United States","https://ClinicalTrials.gov/show/NCT01783821"
193,"The Effects of Music Therapy on Adult Patients Requiring Mechanical Ventilation in the ICU","Enrolling by invitation","No Results Available","Acute Respiratory Distress Syndrome|Acute Hypoxemic Respiratory Failure|Acute Hypercapnic Respiratory Failure","Other: Toning|Other: Ocean drum & SOK melody|Other: SOK|Behavioral: Process|Other: Holding Harmonic Container","All","18 Years and older   (Adult, Older Adult)","Not Applicable","178","September 2024","Mount Sinai West, New York, New York, United States","https://ClinicalTrials.gov/show/NCT03642002"
194,"Clinical Evaluation of a Closed Loop Oxygen Controller for Neonatal Respiratory Care","Terminated","No Results Available","Respiratory Distress Syndrome|Hyperoxia|Prematurity",,"All","up to 3 Months   (Child)",,"20","March 2013","Primary Children's Medical Center, Salt Lake City, Utah, United States|University of Utah Health Sciences Center, Salt Lake City, Utah, United States","https://ClinicalTrials.gov/show/NCT00887731"
195,"A Study Promoting Critical Illness Recovery in the Elderly","Recruiting","No Results Available","Acute Respiratory Distress Syndrome|Critical Illness|Critical Care","Device: cycle ergometry","All","55 Years and older   (Adult, Older Adult)","Not Applicable","42","August 2023","Wake Forest Baptist Medical Center, Winston-Salem, North Carolina, United States","https://ClinicalTrials.gov/show/NCT02963558"
196,"Telehealth-Enhanced Patient-Oriented Recovery Trajectory After ICU","Completed","No Results Available","Critical Illness|Acute Respiratory Distress Syndrome|Septic Shock","Other: Telehealth","All","18 Years and older   (Adult, Older Adult)","Not Applicable","91","February 28, 2023","Vanderbilt University Medical Center, Nashville, Tennessee, United States","https://ClinicalTrials.gov/show/NCT03926533"
197,"Lung Injury Prediction Study","Completed","No Results Available","Respiratory Distress|Acute Lung Injury",,"All","18 Years and older   (Adult, Older Adult)",,"300","February 2010","Mayo Clinic, Rochester, Minnesota, United States","https://ClinicalTrials.gov/show/NCT00889772"
198,"Neotech RAM Cannula Versus Conventional Binasal Prong Continuous Positive Airway Pressure (CPAP) to Treat Respiratory Distress in Low Birth Weight Neonates","Terminated","No Results Available","Respiratory Distress Syndrome, Newborn|Continuous Positive Airway Pressure|Low Birth Weight Infants","Device: RAM Cannula|Device: Binasal Prong CPAP","All","Child, Adult, Older Adult","Not Applicable","8","February 2017","Children's Hospitals and Clinics of Minnesota, Saint Paul, Minnesota, United States","https://ClinicalTrials.gov/show/NCT02168257"
199,"hCT-MSCs for COVID19 ARDS","Terminated","Has Results","COVID|Corona Virus Infection|COVID19","Biological: Human cord tissue mesenchymal stromal cells (hCT-MSC) manufactured by Duke University.|Other: Placebo","All","18 Years and older   (Adult, Older Adult)","Phase 1|Phase 2","12","February 16, 2022","Boca Raton Regional Hospital, Boca Raton, Florida, United States|Jackson Memorial Hospital, Miami, Florida, United States|University of Miami Hospital, Miami, Florida, United States|New York Medical College, Valhalla, New York, United States|Duke Hospital, Durham, North Carolina, United States","https://ClinicalTrials.gov/show/NCT04399889"
200,"Comparison of Two Methods of High Frequency Oscillatory Ventilation in Individuals With Acute Respiratory Distress Syndrome","Completed","No Results Available","Respiratory Distress Syndrome, Adult","Procedure: High Frequency Oscillatory Ventilation-Hi|Procedure: High Frequency Oscillatory Ventilation-Lo","All","18 Years and older   (Adult, Older Adult)","Phase 2","100","June 2009","Johns Hopkins Bayview Medical Center, Baltimore, Maryland, United States|Johns Hopkins Hospital, Baltimore, Maryland, United States|University of Maryland Medical Center, Baltimore, Maryland, United States|Ohio State University Medical Center, Columbus, Ohio, United States|Wilford Hall Medical Center, San Antonio, Texas, United States","https://ClinicalTrials.gov/show/NCT00399581"
201,"Assessment of Analgesics and Sedatives in Mechanically Ventilated Patients With COVID-19","Completed","No Results Available","COVID-19|ARDS|Withdrawal Syndrome|Iatrogenic Disease",,"All","18 Years to 90 Years   (Adult, Older Adult)",,"353","December 31, 2022","Wilkes University, Wilkes-Barre, Pennsylvania, United States","https://ClinicalTrials.gov/show/NCT05336656"
202,"Airway Pressure Release Ventilation in Acute Lung Injury","Terminated","Has Results","Acute Lung Injury|Acute Respiratory Distress Syndrome|Mechanical Ventilation","Device: APRV|Device: Conventional MV","All","18 Years and older   (Adult, Older Adult)","Not Applicable","2","October 15, 2008","Johns Hopkins Hospital Medical Intensive Care Unit, Baltimore, Maryland, United States","https://ClinicalTrials.gov/show/NCT00750204"
203,"Extracellular Vesicle Infusion Treatment for COVID-19 Associated ARDS","Completed","Has Results","COVID-19|ARDS","Biological: ExoFlo|Other: Intravenous normal saline","All","18 Years to 85 Years   (Adult, Older Adult)","Phase 2","102","May 22, 2021","Helen Keller Hospital, Sheffield, Alabama, United States|St. Joseph Heritage Healthcare, Anaheim, California, United States|Donald Guthrie Foundation/ Robert Packer Hospital, Sayre, Pennsylvania, United States|Memorial Hermann Memorial City Medical Center, Houston, Texas, United States|Covenant Health System, Lubbock, Texas, United States|PRX Research, Mesquite, Texas, United States","https://ClinicalTrials.gov/show/NCT04493242"
204,"Early Caffeine and LISA Compared to Caffeine and CPAP in Preterm Infants","Recruiting","No Results Available","Premature Lungs|Respiratory Distress Syndrome|Surfactant Deficiency Syndrome Neonatal","Procedure: Less Invasive Surfactant Administration LISA|Procedure: Continuous Positive Airway Pressure CPAP","All","24 Weeks to 29 Weeks   (Child)","Not Applicable","180","June 2025","University of California, Irvine, Irvine, California, United States|Loma Linda Medical Center, Loma Linda, California, United States|Sharp Mary Birch Hospital for Women & Newborns, San Diego, California, United States","https://ClinicalTrials.gov/show/NCT04209946"
205,"Synchronized Intermittent Mandatory Ventilation (SIMV) Versus Nasal Intermittent Positive Pressure Ventilation (NIPPV) In Preterm Infants With Respiratory Distress","Completed","No Results Available","Respiratory Distress Syndrome, Newborn","Other: Extubation to Nasal IPPV","All","10 Minutes to 120 Minutes   (Child)","Phase 4","110","January 2009","Women's and Children's Hospital, Room l-919, 1240, N.Mission Road, Los Angeles, California, United States|Sharp Mary Birch Hospital for Women, San Diego, California, United States|Medical College of Georgia, Augusta, Georgia, United States|Children's Hospital, OUMC, Oklahoma, Oklahoma, United States","https://ClinicalTrials.gov/show/NCT00486850"
206,"MICU Recovery Clinic","Recruiting","No Results Available","Critical Illness|Sepsis|Respiratory Failure|ARDS","Other: Questionnaires, Physical and Cognitive Function","All","Child, Adult, Older Adult",,"250","June 2024","Wake Forest Baptist Medical Center, Winston-Salem, North Carolina, United States","https://ClinicalTrials.gov/show/NCT02560129"
207,"Treatment of Lung Injury From COVID-19 Infection With Intravenous Sodium Nitrite","Withdrawn","No Results Available","COVID-19|Acute Respiratory Distress Syndrome|Acute Respiratory Failure","Drug: Sodium Nitrite|Drug: Normal Saline","All","18 Years and older   (Adult, Older Adult)","Phase 2","0","August 15, 2020","Participating Research Facility, Tampa, Florida, United States|Participating Research Facility, Fort Worth, Texas, United States","https://ClinicalTrials.gov/show/NCT04401527"
208,"COVID-19 Treatment of Severe Acute Respiratory Syndrome With Veru-111","Completed","Has Results","Respiratory Distress Syndrome, Adult","Drug: Veru-111","All","18 Years and older   (Adult, Older Adult)","Phase 2","39","August 13, 2021","HonorHealth, Scottsdale, Arizona, United States|Methodist Hospital, Saint Louis Park, Minnesota, United States|Regions Hospital, Saint Paul, Minnesota, United States|Inspira Medical Center, Vineland, New Jersey, United States|Memorial Hermann Memorial City Hospital, Houston, Texas, United States","https://ClinicalTrials.gov/show/NCT04388826"
209,"Airway Inflammatory Response During Illness in Children With Respiratory Failure","Withdrawn","No Results Available","Acute Respiratory Failure|Acute Respiratory Infection|Acute Respiratory Distress Syndrome",,"All","up to 17 Years   (Child)",,"0","August 2019","University of North Carolina Hospital at Chapel Hill, Chapel Hill, North Carolina, United States","https://ClinicalTrials.gov/show/NCT02047877"
210,"Seattle-PAP Bubble Nasal CPAP and Work of Breathing","Completed","No Results Available","Respiratory Distress Syndrome In Premature Infants|Bronchopulmonary Dysplasia|Newborn Primary Sleep Apnea","Device: Seattle-PAP","All","6 Hours to 72 Hours   (Child)","Phase 1","40","October 2015","Texas Children's Hospital, Houston, Texas, United States","https://ClinicalTrials.gov/show/NCT02210026"
211,"SURFAXIN® Treatment for Prevention of Bronchopulmonary Dysplasia (BPD) in Very Low Birth Weight (VLBW) Infants.","Terminated","Has Results","Respiratory Distress Syndrome, Newborn|Premature Birth|Bronchopulmonary Dysplasia","Drug: Lucinactant 175 mg/kg|Drug: Lucinactant 90 mg/kg|Drug: Placebo","All","3 Days to 10 Days   (Child)","Phase 2","136","July 2006","Discovery Laboratories, Inc., Warrington, Pennsylvania, United States","https://ClinicalTrials.gov/show/NCT00215540"
212,"Evaluating Health Outcomes and QOL After ALI Among Participants of the ALTA, OMEGA, EDEN, and SAILS ARDS Network Trials","Completed","No Results Available","Respiratory Distress Syndrome, Adult",,"All","18 Years and older   (Adult, Older Adult)",,"922","October 2014","University of Maryland Medical Center, Baltimore, Maryland, United States|Johns Hopkins University, Baltimore, Maryland, United States|Wake Forest University, Winston Salem, North Carolina, United States|Vanderbilt University, Nashville, Tennessee, United States|Intermountain Medical Center, Murray, Utah, United States|University of Washington/Harborview Medical Center, Seattle, Washington, United States","https://ClinicalTrials.gov/show/NCT00719446"
213,"Non-Invasive Monitoring of Respiratory Function in Spontaneously Breathing Patients With COVID-19 Infection","Unknown status","No Results Available","Respiratory Failure|Ventilatory Failure|COVID-19|Pneumonia|ARDS, Human","Device: AirGo Respiratory Monitor","All","18 Years and older   (Adult, Older Adult)",,"500","December 31, 2020","Massachusetts General Hospital, Boston, Massachusetts, United States","https://ClinicalTrials.gov/show/NCT04356443"
214,"Extracellular Vesicle Treatment for Acute Respiratory Distress Syndrome (ARDS) (EXTINGUISH ARDS)","Recruiting","No Results Available","Acute Respiratory Distress Syndrome|ARDS","Biological: ExoFlo|Other: Intravenous normal saline","All","18 Years to 65 Years   (Adult, Older Adult)","Phase 3","320","August 3, 2024","Dignity Health, Chandler, Arizona, United States|Providence St. Jude Medical Center, Fullerton, California, United States|UC Irvine, Orange, California, United States|UC Davis Health, Sacramento, California, United States|JD Medical Group, LLC, Miami, Florida, United States|University Hospitals Cleveland Medical Center, Cleveland, Ohio, United States|Guthrie Medical Group, PC, Sayre, Pennsylvania, United States|PRX Research, Mesquite, Texas, United States","https://ClinicalTrials.gov/show/NCT05354141"
215,"Study of Enbrel (Etanercept) for the Treatment Sub-Acute Pulmonary Dysfunction After Allogeneic Stem Cell Transplant","Completed","Has Results","Lung Injury, Acute|Respiratory Distress Syndrome, Adult|Bronchiolitis Obliterans","Drug: Etanercept","All","6 Years and older   (Child, Adult, Older Adult)","Phase 2","34","February 2009","The University of Michigan Cancer Center, Ann Arbor, Michigan, United States","https://ClinicalTrials.gov/show/NCT00141726"
216,"Etanercept for Non-Infectious Lung Injury Following Bone Marrow Transplantation","Completed","No Results Available","Respiratory Distress Syndrome, Adult|Bronchiolitis Obliterans|Pneumonia","Drug: etanercept","All","12 Months and older   (Child, Adult, Older Adult)","Phase 1|Phase 2","15","September 2003","University of Michigan, Ann Arbor, Michigan, United States","https://ClinicalTrials.gov/show/NCT00029328"
217,"Evaluation of the Safety, Tolerability, and Pharmacokinetics of PLN-74809 in Participants With Acute Respiratory Distress Syndrome (ARDS) Associated With at Least Severe COVID-19","Terminated","Has Results","Acute Respiratory Distress Syndrome|SARS-CoV-2","Drug: PLN-74809|Drug: Placebo","All","18 Years and older   (Adult, Older Adult)","Phase 2","6","August 2, 2021","Valleywise Health Medical Center, Phoenix, Arizona, United States|Cedars-Sinai Medical Center, Los Angeles, California, United States|National Jewish Health, Denver, Colorado, United States|Advent Health, Orlando, Florida, United States|Augusta University Medical Center, Augusta, Georgia, United States|Atlantic Health System, Summit, New Jersey, United States","https://ClinicalTrials.gov/show/NCT04565249"
218,"Nitric Oxide Gas Inhalation Therapy for Mild/Moderate COVID-19","Active, not recruiting","No Results Available","Coronavirus Infections|Pneumonia, Viral|Acute Respiratory Distress Syndrome","Drug: Nitric Oxide","All","18 Years and older   (Adult, Older Adult)","Phase 2","70","April 2025","Providence HealthCare Network, Anchorage, Alaska, United States|Louisiana State University Health Shreveport, Shreveport, Louisiana, United States|Massachusetts General Hospital, Boston, Massachusetts, United States","https://ClinicalTrials.gov/show/NCT04305457"
219,"Human Mesenchymal Stromal Cells For Acute Respiratory Distress Syndrome (START)","Completed","Has Results","Respiratory Distress Syndrome, Adult","Biological: Allogeneic Bone Marrow-Derived Human Mesenchymal Stromal Cells|Biological: Plasma-Lyte A","All","18 Years and older   (Adult, Older Adult)","Phase 2","60","February 9, 2018","University of California San Francisco, San Francisco, California, United States|Stanford University, Stanford, California, United States|Massachusetts General Hospital, Boston, Massachusetts, United States|University of Minnesota Medical Center, Saint Paul, Minnesota, United States|Ohio State University, Columbus, Ohio, United States|University of Pittsburgh, Pittsburgh, Pennsylvania, United States","https://ClinicalTrials.gov/show/NCT02097641"
220,"Continuous Exhaled Breath Condensate pH in Mechanically Ventilated Patients","Unknown status","No Results Available","Respiratory Distress Syndrome, Adult|Respiratory Syncytial Virus Infections|Pneumonia|Acute Lung Injury",,"All","1 Hour and older   (Child, Adult, Older Adult)",,"120","January 2009","University of Virginia, Charlottesville, Virginia, United States","https://ClinicalTrials.gov/show/NCT00429637"
