"Rank","Title","Status","Study Results","Conditions","Interventions","Gender","Age","Phases","Enrollment","Completion Date","Locations","URL"
271,"A Dose-Ranging Study to Determine the Efficacy, Safety and Tolerability of AeroFact","Recruiting","No Results Available","Respiratory Distress Syndrome in Premature Infant","Drug: AeroFact|Other: nCPAP","All","26 Weeks to 31 Weeks   (Child)","Phase 2","261","August 31, 2024","University of Arkansas for Medical Sciences, Little Rock, Arkansas, United States|Alta Bates Summit, Berkeley, California, United States|University of Colorado, Aurora, Colorado, United States|University of Florida Health, Jacksonville, Florida, United States|Wolfson Children's Hospital, Jacksonville, Florida, United States|South Miami Hospital, Miami, Florida, United States|Advent Health, Orlando, Florida, United States|Winnie Palmer Hospital, Orlando, Florida, United States|Northside Hospital Atlanta, Atlanta, Georgia, United States|University of Illinois, Chicago, Illinois, United States|Hospital of South Bend, South Bend, Indiana, United States|University of Kentucky, Louisville, Kentucky, United States|Barbara Bush Medical Center, Portland, Maine, United States|University of Maryland, Baltimore, Maryland, United States|Holy Cross Hospital, Silver Spring, Maryland, United States|Beth Israel Deaconess Medical Center, Boston, Massachusetts, United States|Children's and Women's (C & W) Mott Hospital, Ann Arbor, Michigan, United States|Children's Health Care d/b/a Children's Minnesota, Minneapolis, Minnesota, United States|University of Minnesota Masonic Children's Hospital, Minneapolis, Minnesota, United States|Mayo Clinic, Rochester, Minnesota, United States|University of Mississippi, Jackson, Mississippi, United States|Dartmouth Hitchcock Medical Center, Lebanon, New Hampshire, United States|Maimonides Hospital, Brooklyn, New York, United States|Mount Sinai Kravis Children's Hospital, New York, New York, United States|NY Presbyterian Morgan Stanley Children's Hospital-Columbia, New York, New York, United States|West Chester Medical Center-Maria Fareri Children's Hospital, Valhalla, New York, United States|Levine Children's Hospital, Charlotte, North Carolina, United States|Grant Hospital, Columbus, Ohio, United States|Texas Health-Methodist Harris, Fort Worth, Texas, United States|Women's Hospital of Texas, Houston, Texas, United States|Children's Hospital of San Antonio (CHofSA), San Antonio, Texas, United States|Methodist Children's Hospital, San Antonio, Texas, United States|North Central Baptist Hospital, San Antonio, Texas, United States|University of Virginia, Charlottesville, Virginia, United States|University of Washington, Seattle, Washington, United States|IWK Hospital, Halifax, Nova Scotia, Canada|The Ottawa Hospital, Ottawa, Ontario, Canada|Mt. Sinai Hospital, Toronto, Ontario, Canada|CHU de Québec-Université Laval, Québec City, Quebec, Canada","https://ClinicalTrials.gov/show/NCT03969992"
272,"Tolerability and Efficacy of RJX in Patients With COVID-19","Active, not recruiting","No Results Available","COVID-19|Acute Respiratory Distress Syndrome|SARS-CoV-2|Hypoxemia","Drug: Rejuveinix (RJX) Active Comparator|Drug: Placebo Comparator","All","18 Years and older   (Adult, Older Adult)","Phase 1|Phase 2","237","February 2023","Memorial Hermann Memorial City Medical Center, Houston, Texas, United States|Memorial Hermann Southeast Hospital, Houston, Texas, United States|Christus Santa Rosa Hospital, New Braunfels, Texas, United States","https://ClinicalTrials.gov/show/NCT04708340"
273,"Assessment of Efficacy and Safety of Ruxolitinib in Participants With COVID-19-Associated ARDS Who Require Mechanical Ventilation (RUXCOVID-DEVENT)","Terminated","Has Results","COVID-19","Drug: Placebo|Drug: Ruxolitinib","All","12 Years and older   (Child, Adult, Older Adult)","Phase 3","211","February 26, 2021","Honor Health Research Institute, Scottsdale, Arizona, United States|Sharp Memorial Hospital, San Diego, California, United States|Georgetown University Hospital, Washington, District of Columbia, United States|Teradan Clinical Trials, Brandon, Florida, United States|University of Florida, Gainesville, Florida, United States|Tampa General Hospital, Tampa, Florida, United States|University of South Florida, Tampa, Florida, United States|Northshore University Health System, Chicago, Illinois, United States|Loyola University Medical Center, Maywood, Illinois, United States|Indiana University Simon Cancer Center, Indianapolis, Indiana, United States|Indiana University Health Central Indiana Cancer Centers, Indianapolis, Indiana, United States|East Jefferson General Hospital, Metairie, Louisiana, United States|Johns Hopkins University, Baltimore, Maryland, United States|Boston Medical Center, Boston, Massachusetts, United States|Lahey Hospital & Medical Center, Burlington, Massachusetts, United States|University of Massachusetts Medical School, Worcester, Massachusetts, United States|Healthpartners Cancer Care Center - Regions Hospital, Saint Paul, Minnesota, United States|Mercy Research, Springfield, Missouri, United States|Hackensack University Medical Center, Hackensack, New Jersey, United States|Rutgers Njms Clinical Research Unit, Newark, New Jersey, United States|Holy Name Medical Center, Teaneck, New Jersey, United States|University of Rochester Medical Center, Rochester, New York, United States|Duke University Medical Center, Durham, North Carolina, United States|East Carolina University, Greenville, North Carolina, United States|University of Cincinnati, Cincinnati, Ohio, United States|Kettering Cancer Care, Dayton, Ohio, United States|Jefferson University Hospitals, Philadelphia, Pennsylvania, United States|Temple University, Philadelphia, Pennsylvania, United States|West Penn Hospital, Pittsburgh, Pennsylvania, United States|Allegheny Health Network, Wexford, Pennsylvania, United States|St David'S Medical Center, Austin, Texas, United States|University of Texas Health Science Center At Houston - McGovern Medical School, Houston, Texas, United States|University of Texas Health Science Cente, San Antonio, Texas, United States|Wenatchee Valley Hospital and Clinics, Wenatchee, Washington, United States|Aurora Research Institute, Milwaukee, Wisconsin, United States|Sbih City Hospital 15, Saint Petersburg, Russian Federation","https://ClinicalTrials.gov/show/NCT04377620"
274,"Acute Respiratory Distress Syndrome Clinical Network (ARDSNet)","Completed","No Results Available","Respiratory Distress Syndrome, Adult|Lung Diseases","Procedure: Low Tidal Volume Ventilation|Procedure: Positive End-Expiratory Pressure|Drug: Lysofylline|Drug: Methylprednisolone|Drug: Ketoconazole|Procedure: Fluid Management|Procedure: Pulmonary Artery Catheter","All","13 Years and older   (Child, Adult, Older Adult)","Phase 3",,"July 2004","University of California, San Francisco, California, United States|University of Colorado Health Sciences Center, Denver, Colorado, United States|University of Chicago, Chicago, Illinois, United States|Louisiana State University, New Orleans, Louisiana, United States|University of Maryland, Baltimore, Maryland, United States|Massachusetts General Hospital, Boston, Massachusetts, United States|Baystate Medical Center, Springfield, Massachusetts, United States|University of Michigan, Ann Arbor, Michigan, United States|Mayo Foundation, Rochester, Minnesota, United States|Duke University, Durham, North Carolina, United States|Wake Forest University, Winston-Salem, North Carolina, United States|Cleveland Clinic Foundation, Cleveland, Ohio, United States|University of Pennsylvania, Philadelphia, Pennsylvania, United States|University of Pittsburgh, Pittsburgh, Pennsylvania, United States|Vanderbilt University, Nashville, Tennessee, United States|Baylor College of Medicine, Houston, Texas, United States|University of Texas, San Antonio, Texas, United States|Latter Day Saints Hospital, Salt Lake City, Utah, United States|University of Virginia, Charlottesville, Virginia, United States|University of Washington, Seattle, Washington, United States|University of British Columbia, Vancouver, British Columbia, Canada","https://ClinicalTrials.gov/show/NCT00000579"
275,"The Safety and Efficacy of Lucinactant for Inhalation in Premature Neonates 26 to 32 Weeks Gestational Age","Completed","Has Results","Respiratory Distress Syndrome","Drug: Lucinactant delivered via investigational delivery device|Drug: nCPAP","All","26 Weeks to 32 Weeks   (Child)","Phase 2","221","August 6, 2019","University of Alabama at Birmingham, Birmingham, Alabama, United States|Univ. of Arkansas Medical Center, Little Rock, Arkansas, United States|Loma Linda University Medical Center, Loma Linda, California, United States|Children's Hospital of Orange County, Orange, California, United States|Sharp Mary Birch Hospital for Women and Newborns, San Diego, California, United States|Christiana Care Health System, Newark, Delaware, United States|University of Miami Holtz Children's Hospital, Miami, Florida, United States|University of Michigan Health System, Ann Arbor, Michigan, United States|University of Mississippi Medical Center, Jackson, Mississippi, United States|University of Nebraska Medical Center, Omaha, Nebraska, United States|Albany Medical Center, Albany, New York, United States|Morgan Stanley Childrens Hospital of New York Presbyterian (CHONY), New York, New York, United States|Duke University Medical Center, Durham, North Carolina, United States|Brody School of Medicine at ECU, Greenville, North Carolina, United States|New Hanover Regional Medical Center, Wilmington, North Carolina, United States|Case Western Reserve University (Rainbow Babies Hosp.), Cleveland, Ohio, United States|Ohio State University, Columbus, Ohio, United States|Providence St. Vincent Medical Center, Portland, Oregon, United States|Women and Infants Hospital, Providence, Rhode Island, United States|Baylor University Medical Center, Dallas, Texas, United States|Cook Children's Hospital, Fort Worth, Texas, United States|Texas Health Harris Methodist Hospital, Fort Worth, Texas, United States|Foothills Medical Centre, Calgary, Alberta, Canada|Royal Alexandra Hospital, Edmonton, Alberta, Canada|Sunnybrook Health Sciences Centre, Toronto, Ontario, Canada|Montreal Children's Hospital, Montreal, Quebec, Canada|Sainte Justine Hospital, Montreal, Quebec, Canada|Hospital Dr Sotero Del Rio, Santiago, Region-MetropolitanadeSantiago, Chile|Hospital Clínico Regional de Concepción Dr Guillermo Grant Benavente, Concepción, Chile|Hospital San Jose, Santiago, Chile|Clinica Alamena de Santiago, Santiago, Chile|Hospital Santiago Oriente Dr Luis Tisné Brousse, Santiago, Chile|Hospital Clinico de la Pontificia Universidad Catolica de Chile, Santiago, Chile|Hospital San Juan de Dios, Santiago, Chile|Fundacion Hospitalaria San Vicente de Paul, Medellin, Antioquia, Colombia|Hospital General de Medellin, Medellin, Antioquia, Colombia|Fundacion Valle Del Lili, Cali, Valle Del Cauca, Colombia|Semmelweis Egyetem, Budapest, Hungary|Csolnoky Ferenc Korhaz, Debrecen, Hungary|Debreceni Egyetem Klinikai Kozpont, Debrecen, Hungary|Borsod-Abauj-Zemplen Megyei Korhaz es Egyetemi Okato, Miskolc, Hungary|Szabolcs-Szatmar-Bereg Megyei Korhazak es Egyetemi Oktatokorhaz, Nyiregyhaza, Hungary|Cork University Hospital, Cork, Ireland|Mid-Western Regional Hospital Limerick, Limerick, Ireland|Erasmus Medical Center, Rotterdam, Netherlands|Uniwersytecki Szpital Kliniczny im. Jana Mikulicza Radeckiego we Wroclawiu, Wroclaw, Dolnoslaskie, Poland|S.U. nr2im. Dr. Jana Biziela Oddzial Kliniczny N. W. Z. Intensywna Terapia Noworodka wraz z Wgjazdowy m Zespolem N, Bydgoszcz, Kujawsko-pomorksie, Poland|Instytut Centrum Zdrowja Matki Polki Klinika Neonatologii, Lodz, Lodzkie, Poland|SP ZOZ Szpital Uniwersytecki w Krakowie, Oddzial Neonatologii, Krakow, Malopolskie, Poland|Szpital Kliniczny im. Ks, Anny Mazowieckiej Klinika Neonatologii, Warsaw, Mazowieckie, Poland|Uniwersyteckie Centrum Kliniczne, Gdansk, Pomorskie, Poland|Szpital Spegialistycszny nr 2 w Bytomia Oddzial Noworodkow Blok V, Bytom, Slaskie, Poland|Samodzielny Publiczny Specjalistczny Zaklad Opieki Zdrowotnej Zdroje, Szczecin, West Pomerania, Poland|Ginekologiczno-Polozniczy Szpital Klinicznym UM im. Karola Marcinkowskiego w Poznan i u Katedra Neonatologii, Poznan, Wielkopolskie, Poland","https://ClinicalTrials.gov/show/NCT02636868"
276,"A Study of APL-9 in Adults With Mild to Moderate ARDS Due to COVID-19","Completed","Has Results","COVID|Covid-19|Coronavirus|Coronavirus Infection|Severe Acute Respiratory Syndrome|Severe Acute Respiratory Syndrome Coronavirus 2|Sars-CoV2|Ards|Acute Respiratory Distress Syndrome","Drug: APL-9|Other: Vehicle Control","All","18 Years and older   (Adult, Older Adult)","Phase 1|Phase 2","72","February 13, 2021","University of California at San Francisco - Fresno, Fresno, California, United States|California Pacific Medical Center, San Francisco, California, United States|Baptist Medical Center Beaches, Jacksonville Beach, Florida, United States|Westchester General Hospital, Miami, Florida, United States|Northwestern University, Feinberg School of Medicine, Chicago, Illinois, United States|Loyola University Medical Center, Maywood, Illinois, United States|Lutheran Health Physicians, Fort Wayne, Indiana, United States|University of Iowa Hospitals and Clinics, Iowa City, Iowa, United States|Norton Women's and Children's Hospital, Louisville, Kentucky, United States|Norton Audobon Hospital, Louisville, Kentucky, United States|Cambridge Medical Trials, Alexandria, Louisiana, United States|Ascension Providence Hospital, Southfield, Michigan, United States|Rutgers University - Robert Wood Johnson Medical School, New Brunswick, New Jersey, United States|University at Buffalo, Buffalo, New York, United States|Columbia University, New York, New York, United States|Texas A&M College of Medicine - Scott and White, Temple, Texas, United States|Hospital Angelina Caron, Campina Grande Do Sul, Paraná, Brazil|Irmandade da Santa Casa de Misericordia de Porto Alegre, Porto Alegre, Rio Grande Do Sul, Brazil|Hospital São Lucas da PUCRS, Porto Alegre, Rio Grande Do Sul, Brazil|Hospital Estadual Mario Covas, Santo André, Sao Paulo, Brazil|CEMEC - Centro Multidisciplinar de Estudos Clinicos LTDA EPP, São Bernardo Do Campo, Sao Paulo, Brazil|Hospital Alemao Oswaldo Cruz, São Paulo, Sao Paulo, Brazil|Hospital Santa Marcelina, São Paulo, Sao Paulo, Brazil|UPECLIN - Unidade de Pesquisa Clínica da Faculdade de Medicina de Botucatu - FMB/UNESP, Botucatu, São Paulo, Brazil","https://ClinicalTrials.gov/show/NCT04402060"
277,"A Study in Preterm Neonates With RDS to Compare CUROSURF® Administration Through LISA and Conventional Administration","Terminated","No Results Available","Respiratory Distress Syndrome, Newborn","Combination Product: LISA combination product (Curosurf+catheter CHF6440)|Drug: Curosurf through conventional administration (endotracheal tube)","All","30 Minutes to 24 Hours   (Child)","Phase 3","33","August 13, 2022","Chiesi Clinical Trial Site 84029, Little Rock, Arkansas, United States|Chiesi Clinical Trial Site 84001, Los Angeles, California, United States|Chiesi Clinical Trial Site 84002, Los Angeles, California, United States|Chiesi Clinical Trial Site 84013, Denver, Colorado, United States|Chiesi Clinical Trial Site 84026, New Britain, Connecticut, United States|Chiesi Clinical Trial Site 84003, Evanston, Illinois, United States|Chiesi Clinical Trial Site 84021, Peoria, Illinois, United States|Chiesi Clinical Trial Site 84023, Lexington, Kentucky, United States|Chiesi Clinical Trial Site 84028, Springfield, Massachusetts, United States|Chiesi Clinical Trial Site 84005, Worcester, Massachusetts, United States|Chiesi Clinical Trial Site 84008, Lansing, Michigan, United States|Chiesi Clinical Trial Site 84004, Saint Louis, Missouri, United States|Chiesi Clinical Trial Site 84012, Camden, New Jersey, United States|Chiesi Clinical Trial Site 84024, Manhasset, New York, United States|Chiesi Clinical Trial Site 84019, New Hyde Park, New York, United States|Chiesi Clinical Trial Site 84009, Valhalla, New York, United States|Chiesi Clinical Trial Site 84027, Greenville, North Carolina, United States|Chiesi Clinical Trial Site 84010, Wilmington, North Carolina, United States|Chiesi Clinical Trial Site 84025, Cincinnati, Ohio, United States|Chiesi Clinical Trial Site 84017, Oklahoma City, Oklahoma, United States|Chiesi Clinical Trial Site 84020, Hershey, Pennsylvania, United States|Chiesi Clinical Trial Site 84007, Nashville, Tennessee, United States|Chiesi Clinical Trial Site 84011, Lubbock, Texas, United States|Chiesi Clinical Trial Site 84006, Plano, Texas, United States|Chiesi Clinical Trial Site 84022, Temple, Texas, United States|Chiesi Clinical Trial Site 84015, Charlottesville, Virginia, United States","https://ClinicalTrials.gov/show/NCT02772081"
278,"Effects of TNX-832 (Sunol cH36) in Subjects With Acute Lung Injury/Acute Respiratory Distress Syndrome","Completed","No Results Available","Sepsis|Acute Lung Injury|Acute Respiratory Distress Syndrome","Biological: TNX-832|Drug: Placebo","All","18 Years and older   (Adult, Older Adult)","Phase 1","18","February 2008","University of Miami, Miami, Florida, United States|Beth Israel Deconess Medical Center, Boston, Massachusetts, United States|Washington University, St. Louis, Missouri, United States|Wake Forest University, Winston-Salem, North Carolina, United States|Akron General Medical Center, Akron, Ohio, United States|Baylor School of Medicine, Houston, Texas, United States|Capital Health, Halifax, Nova Scotia, Canada","https://ClinicalTrials.gov/show/NCT01438853"
279,"Wide Scale Monitoring for Acute Respiratory Infection Using a Mobile-Based Study Platform","Completed","No Results Available","Covid19|Influenza|Respiratory Tract Infections|Acute Respiratory Tract Infection|Acute Respiratory Distress Syndrome",,"All","18 Years and older   (Adult, Older Adult)",,"16000","December 8, 2021","Boston Children's Hospital, Boston, Massachusetts, United States","https://ClinicalTrials.gov/show/NCT04663776"
280,"Anti-TF Antibody (ALT-836) to Treat Septic Patients With Acute Lung Injury or Acute Respiratory Distress Syndrome","Completed","No Results Available","Sepsis|Acute Lung Injury|Acute Respiratory Distress Syndrome","Drug: ALT-836|Drug: Placebo","All","18 Years and older   (Adult, Older Adult)","Phase 2","150","January 2013","Los Angeles County and USC Medical Center, Los Angeles, California, United States|UC Davis Medical Center, Sacramento, California, United States|Stanford University, Stanford, California, United States|Yale University, New Haven, Connecticut, United States|Northwestern University, Chicago, Illinois, United States|West Suburban Hospital Medical Center, Oak Park, Illinois, United States|Illinois Lung and Critical Care Institute, Peoria, Illinois, United States|University of Iowa, Iowa City, Iowa, United States|Kentucky Lung Clinic, Hazard, Kentucky, United States|University of Louisville-Division of Pulmonary and Critical Care, Louisville, Kentucky, United States|Baystate Medical Center, Springfield, Massachusetts, United States|Saint Luke's Hospital, Kansas City, Missouri, United States|Saint Louis University, St. Louis, Missouri, United States|Mercy Hospital St. Louis, St. Louis, Missouri, United States|Mount Sinai Medical Center, New York City, New York, United States|Memorial Sloan-Kettering Cancer Center, New York, New York, United States|Carolinas Medical Center, Charlotte, North Carolina, United States|Piedmont Respiratory Research Foundation, Greensboro, North Carolina, United States|Wake Forest University, Winston-Salem, North Carolina, United States|University of Oklahoma, Oklahoma City, Oklahoma, United States","https://ClinicalTrials.gov/show/NCT00879606"
281,"Careful Ventilation in Acute Respiratory Distress Syndrome (COVID-19 and Non-COVID-19)","Recruiting","No Results Available","ARDS","Other: Respiratory Mechanics|Other: Standard Ventilation Strategy","All","18 Years and older   (Adult, Older Adult)","Not Applicable","740","November 2024","New York University Grossman School of Medicine, New York, New York, United States|Centro de Educación Médica e Investigaciones Clínicas Dr Norberto Quirno (CEMIC), Buenos Aires, Argentina|Complejo Médico Policía Federal Argentina Churruca Visca, Buenos Aires, Argentina|Hospital Británico de Buenos Aires, Buenos Aires, Argentina|Sanatorio Anchorena Recoleta, Buenos Aires, Argentina|Sanatorio Mater Dei, Buenos Aires, Argentina|Sanatorio Anchorena San Martín, San Martín, Argentina|St. Michael's Hospital, Toronto, Canada|Toronto General Hospital, Toronto, Canada|Toronto Western Hospital, Toronto, Canada|Pontificia Universidad Católica de Chile, Santiago de Chile, Chile|Centre hospitalier universitaire d'Angers, Angers, France|CH Victor Dupouy, Argenteuil, France|CH de Beauvais, Beauvais, France|CHU Bordeaux - Haut Leveque, Bordeaux, France|Hopital de la Cavale Blanche - CHRU Brest, Brest, France|CH de Cholet, Cholet, France|Hopital Intercommunal de Creteil, Creteil, France|CHU Grenoble-Alpes, Grenoble, France|Hopital Roger Salengro - CHU Lille, Lille, France|Groupe Hospitalier de la Region de Mulhouse et Sud Alsace, Mulhouse, France|Hopital de l'Archet 1 - CHU de Nice, Nice, France|Hopital Europeen Georges-Pompidou, Paris, France|CHU de Poitiers - La Miletrie, Poitiers, France|CH Bretagne Atlantique Vannes-Auray, Vannes, France|HIA Robert Picque, Villenave-d'Ornon, France|Arcispedale Sant'Anna, Ferrara, Italy|University of Foggia, Foggia, Italy|Policlinico Universitario Agostino Gemelli IRCCS, Rome, Italy|L'Hospital de la Santa Creu i Sant Pau, Barcelona, Spain|Vall d'Hebron University Hospital, Barcelona, Spain","https://ClinicalTrials.gov/show/NCT03963622"
282,"Double-Blind, Multicenter, Study to Evaluate the Efficacy of PLX PAD for the Treatment of COVID-19","Active, not recruiting","No Results Available","COVID|ARDS","Biological: PLX-PAD|Biological: Placebo","All","40 Years to 80 Years   (Adult, Older Adult)","Phase 2","66","February 2023","University of California Irvine, Irvine, California, United States|University of Southern California (USC) - Keck School of Medicine (KSOM), Los Angeles, California, United States|University Of California Davis,4860 Y Street, Sacramento, California, United States|Baptist Health Medical Center, Jacksonville, Florida, United States|Medical College of Georgia at Augusta University, Augusta, Georgia, United States|Sarah Cannon Research Institute, LLC (Mercer University School of Medicine), Macon, Georgia, United States|University of Mississippi Medical Center, Jackson, Mississippi, United States|Cooper Research Institute, Camden, New Jersey, United States|Holy Medical Center, Teaneck, New Jersey, United States|Montefiore Medical Center, New York, New York, United States|Maimonides Medical Center, New York, New York, United States|Mercy Medical Center, New York, New York, United States|Thomas Jefferson University, Philadelphia, Pennsylvania, United States","https://ClinicalTrials.gov/show/NCT04389450"
283,"Plasma Adsorption in Patients With Confirmed COVID-19","Completed","No Results Available","Respiratory Failure|ARDS","Device: Marker Therapeutics D2000 Cartridge (D2000) for use with the Spectra Optia® Apheresis System (Optia SPD Protocol)","All","18 Years and older   (Adult, Older Adult)","Not Applicable","107","April 1, 2022","University of Arkansas for Medical Sciences (UAMS), Little Rock, Arkansas, United States|UNM Health Science Center, Albuquerque, New Mexico, United States|Providence Portland Medical Center, Portland, Oregon, United States|Reading Hospital, West Reading, Pennsylvania, United States|UT Southwestern/Clements Hospital, Dallas, Texas, United States|UTMB, Galveston, Texas, United States|Inova Fairfax Medical Campus, Falls Church, Virginia, United States","https://ClinicalTrials.gov/show/NCT04358003"
284,"A Phase II Randomized Trial of Fish Oil in Patients With Acute Lung Injury (ALI)","Completed","Has Results","Respiratory Distress Syndrome, Adult|Acute Lung Injury|Acute Respiratory Distress Syndrome","Drug: Fish oil (eicosapentaenoic acid and docosahexanoic acid)","All","18 Years and older   (Adult, Older Adult)","Phase 2","90","August 2009","St. Alphonsus Medical Center, Boise, Idaho, United States|Oregon Health Sciences University, Portland, Oregon, United States|University of Vermont/Fletcher Allen Health Care, Burlington, Vermont, United States|Harborview Medical Center, Seattle, Washington, United States|St. Michael's Hospital, Toronto, Ontario, Canada","https://ClinicalTrials.gov/show/NCT00351533"
285,"Post Acute Sequelae of COVID-19","Recruiting","No Results Available","Covid19|Sars-CoV-2 Infection|Dyspnea Caused by 2019-nCoV|COVID-19 Acute Respiratory Distress Syndrome|Pulmonary Fibrosis","Other: Cohort study","All","18 Years and older   (Adult, Older Adult)",,"500","May 2027","Vanderbilt_University MC, Nashville, Tennessee, United States","https://ClinicalTrials.gov/show/NCT04964115"
286,"Ventilation and Perfusion in the Respiratory System","Enrolling by invitation","No Results Available","Respiratory Failure|Respiratory Distress Syndrome, Adult|Critical Illness|Pulmonary Disease|Ventilator-Induced Lung Injury","Device: Electrical Impedance tomography|Other: Lung mechanics and gas exchange","All","18 Years and older   (Adult, Older Adult)",,"20","July 2024","University of California San Diego Health, La Jolla, California, United States","https://ClinicalTrials.gov/show/NCT05081895"
