"Rank","Title","Status","Study Results","Conditions","Interventions","Gender","Age","Phases","Enrollment","Completion Date","Locations","URL"
348,"Observational Study of Expected ARF Recovery","Completed","No Results Available","Acute Respiratory Failure|Post Intensive Care Syndrome",,"All","18 Years and older   (Adult, Older Adult)",,"180","December 1, 2021","Johns Hopkins University, Baltimore, Maryland, United States|Beth Israel Deaconess Medical Center, Boston, Massachusetts, United States|Vanderbilt University, Nashville, Tennessee, United States|Intermountain Medical Center, Murray, Utah, United States","https://ClinicalTrials.gov/show/NCT03797313"
349,"Sedation Management in Pediatric Patients With Acute Respiratory Failure (The RESTORE Study)","Completed","No Results Available","Respiratory Insufficiency|Respiratory Distress Syndrome, Newborn|Lung Diseases","Behavioral: Team approach to sedation management|Behavioral: Usual approach to sedation management","All","2 Weeks to 18 Years   (Child, Adult)","Phase 3","2449","December 2013","Children's Hospital of Alabama, Birmingham, Alabama, United States|University Medical Center, The University of Arizona, Tucson, Arizona, United States|Children's Hospital and Research Center at Oakland, Oakland, California, United States|Children's Hospital of Orange County, Orange, California, United States|Lucile Salter Packard Children's Hospital at Stanford, Palo Alto, California, United States|University of California Davis Medical Center, Sacramento, California, United States|Children's Hospital at University of California San Francisco Medical Center, San Francisco, California, United States|Connecticut Children's Medical Center, Hartford, Connecticut, United States|Yale-New Haven Children's Hospital, New Haven, Connecticut, United States|Nemours/Alfred I. duPont Hospital for Children, Wilmington, Delaware, United States|Holtz Children's Hospital, Miami, Florida, United States|Florida Hospital for Children, Orlando, Florida, United States|Children's Memorial Hospital, Chicago, Chicago, Illinois, United States|Advocate Hope Children's Hospital, Oak Lawn, Illinois, United States|University of Maryland Hospital for Children, Baltimore, Maryland, United States|Johns Hopkins Children's Center, Baltimore, Maryland, United States|University of Massachusetts Memorial Children's Medical Center, Worcester, Massachusetts, United States|C. S. Mott Children's Hospital of the University of Michigan, Ann Arbor, Michigan, United States|Children's Mercy Hospital, Kansas City, Kansas City, Missouri, United States|St. Louis Children's Hospital, St. Louis, Missouri, United States|University of Nebraska Medical Center, Omaha, Nebraska, United States|Dartmouth-Hitchcock Medical Center, Lebanon, New Hampshire, United States|The Children's Hospital at Montefiore, Bronx, New York, United States|Cohen Children's Medical Center of New York, New Hyde Park, New York, United States|Duke Children's Hospital and Health Center, Durham, North Carolina, United States|Doernbecher Children's Hospital, Portland, Oregon, United States|Children's Hospital of Philadelphia, Philadelphia, Pennsylvania, United States|Monroe Carell, Jr. Children's Hospital at Vanderbilt, Nashville, Tennessee, United States|Medical City Children's Hospital, Dallas, Texas, United States|Children's Medical Center Dallas, Dallas, Texas, United States|Primary Children's Medical Center, Salt Lake City, Utah, United States","https://ClinicalTrials.gov/show/NCT00814099"
350,"The Budesonide in Babies (BiB) Trial","Recruiting","No Results Available","Bronchopulmonary Dysplasia (BPD)|Respiratory Distress Syndrome|Prematurity; Extreme|Neonatal","Drug: budesonide (Pulmicort nebulizing suspension).|Drug: surfactant (poractant alfa;Curosurf)","All","up to 48 Hours   (Child)","Phase 3","1160","September 30, 2027","University of Alabama, Birmingham, Alabama, United States|Stanford University, Palo Alto, California, United States|Emory University, Atlanta, Georgia, United States|University of Iowa, Iowa City, Iowa, United States|University of New Mexico, Albuquerque, New Mexico, United States|University of Rochester, Rochester, New York, United States|RTI International, Durham, North Carolina, United States|Duke University, Durham, North Carolina, United States|Cincinnati Children's Medical Center, Cincinnati, Ohio, United States|Case Western Reserve University, Rainbow Babies and Children's Hospital, Cleveland, Ohio, United States|Research Institute at Nationwide Children's Hospital, Columbus, Ohio, United States|University of Pennsylvania, Philadelphia, Pennsylvania, United States|Brown University - Women and Infants Hospital of Rhode Island, Providence, Rhode Island, United States|University of Texas Southwestern Medical Center at Dallas, Dallas, Texas, United States|University of Texas Health Science Center at Houston, Houston, Texas, United States|University of Utah, Salt Lake City, Utah, United States","https://ClinicalTrials.gov/show/NCT04545866"
351,"Fostamatinib for Hospitalized Adults With COVID-19","Completed","Has Results","Coronavirus Disease 2019","Drug: Placebo|Drug: fostamatinib","All","18 Years and older   (Adult, Older Adult)","Phase 2","59","April 30, 2021","National Institutes of Health Clinical Center, Bethesda, Maryland, United States|INOVA Health Systems, Falls Church, Virginia, United States","https://ClinicalTrials.gov/show/NCT04579393"
352,"Antenatal Late Preterm Steroids (ALPS): A Randomized Placebo-Controlled Trial","Completed","Has Results","Pregnancy|Respiratory Distress Syndrome|Pregnancy Outcomes|Preterm Birth","Drug: Betamethasone|Drug: Placebo","Female","Child, Adult, Older Adult","Phase 3","2831","August 31, 2022","University of Alabama - Birmingham, Birmingham, Alabama, United States|Stanford University, Stanford, California, United States|University of Colorado, Denver, Colorado, United States|Northwestern University, Chicago, Illinois, United States|Wayne State University, Detroit, Michigan, United States|Columbia University, New York, New York, United States|University of North Carolina - Chapel Hill, Chapel Hill, North Carolina, United States|Duke University, Durham, North Carolina, United States|Case Western Reserve University, Cleveland, Ohio, United States|Ohio State University, Columbus, Ohio, United States|Oregon Health & Science University, Portland, Oregon, United States|University of Pittsburgh Magee Womens Hospital, Pittsburgh, Pennsylvania, United States|Brown University, Providence, Rhode Island, United States|University of Texas - Southwest, Dallas, Texas, United States|University of Texas - Galveston, Galveston, Texas, United States|University of Texas - Houston, Houston, Texas, United States|University of Utah Medical Center, Salt Lake City, Utah, United States","https://ClinicalTrials.gov/show/NCT01222247"
353,"Acetaminophen and Ascorbate in Sepsis: Targeted Therapy to Enhance Recovery","Recruiting","No Results Available","Acute Respiratory Distress Syndrome|Critical Illness|Respiratory Failure|Sepsis","Drug: Intravenous Acetaminophen (room temperature)|Drug: Intravenous Vitamin C (refrigerated)|Drug: 5% Dextrose (room temperature)|Drug: 5% Dextrose refrigerated","All","18 Years and older   (Adult, Older Adult)","Phase 2","900","July 2023","University of Alabama Medical Center, Birmingham, Alabama, United States|University of Arizona, Tucson, Arizona, United States|UCSF Fresno, Fresno, California, United States|Cedars-Sinai Medical Center, Los Angeles, California, United States|Ronald Reagan UCLA Medical Center, Los Angeles, California, United States|UC Davis Medical Center, Sacramento, California, United States|UCSF Medical Center, San Francisco, California, United States|Stanford University, Stanford, California, United States|University of Colorado Hospital, Aurora, Colorado, United States|Denver Health Medical Center, Denver, Colorado, United States|University of Kentucky, Lexington, Kentucky, United States|University Medical Center, New Orleans, Louisiana, United States|Maine Medical Center, Portland, Maine, United States|Massachusetts General Hospital, Boston, Massachusetts, United States|Beth Israel Deaconess Medical Center, Boston, Massachusetts, United States|Baystate Medical Center, Springfield, Massachusetts, United States|University of Michigan Medical Center, Ann Arbor, Michigan, United States|Henry Ford Medical Center, Detroit, Michigan, United States|Fairview Southdale Hospital, Edina, Minnesota, United States|Hennepin County Medical Center, Minneapolis, Minnesota, United States|University of Mississippi Medical Center, Jackson, Mississippi, United States|Montefiore Medical Center-Weiler, Bronx, New York, United States|Montefiore Medical Center-Moses, Bronx, New York, United States|Mt. Sinai Hospital, New York, New York, United States|Carolinas Medical Center, Charlotte, North Carolina, United States|Wake Forest Baptist Medical Center, Winston-Salem, North Carolina, United States|University of Cincinnati Medical Center, Cincinnati, Ohio, United States|Cleveland Clinic Foundation, Cleveland, Ohio, United States|Ohio State University Wexner Medical Center, Columbus, Ohio, United States|Oregon Health and Science University, Portland, Oregon, United States|Temple University Hospital, Philadelphia, Pennsylvania, United States|UPMC Presbyterian/Mercy/Shadyside/Magee, Pittsburgh, Pennsylvania, United States|Medical University of South Carolina, Charleston, South Carolina, United States|Vanderbilt University Medical Center, Nashville, Tennessee, United States|University of Texas Health Science Center, Houston, Texas, United States|Intermountain Medical Center, Murray, Utah, United States|University of Utah Hospital, Salt Lake City, Utah, United States|University of Virginia Health System, Charlottesville, Virginia, United States|Sentara/EVMS, Norfolk, Virginia, United States|VCU Medical Center, Richmond, Virginia, United States|Harborview Medical Center, Seattle, Washington, United States|Swedish Hospital First Hill, Seattle, Washington, United States","https://ClinicalTrials.gov/show/NCT04291508"
354,"Cardiac Magnetic Resonance Tissue Characterization in COVID-19 Survivors","Recruiting","No Results Available","COVID-19 Pneumonia|COVID-19|COVID-19 Respiratory Infection|COVID-19 Acute Respiratory Distress Syndrome|COVID-19 Lower Respiratory Infection|COVID-19 Acute Bronchitis|Coronavirus Disease 2019","Diagnostic Test: Cardiac MRI|Diagnostic Test: Echocardiogram|Diagnostic Test: 6-minute walk test|Diagnostic Test: Questionnaire","All","18 Years and older   (Adult, Older Adult)",,"510","July 30, 2026","New York Presbyterian-Brooklyn Methodist Hospital, Brooklyn, New York, United States|New York Presbyterian Queens, New York, New York, United States|Weill Cornell Medicine/New-York Presbyterian Hospital, New York, New York, United States","https://ClinicalTrials.gov/show/NCT05164744"
355,"Ganciclovir/Valganciclovir for Prevention of CMV Reactivation in Acute Injury of the Lung and Respiratory Failure","Completed","Has Results","Acute Lung Injury|Acute Respiratory Distress Syndrome|Respiratory Failure","Drug: IV Ganciclovir|Drug: Placebo","All","18 Years and older   (Adult, Older Adult)","Phase 2","160","October 28, 2016","University of Colorado / National Jewish Health / Swedish Medical Center, Denver, Colorado, United States|Northwestern University, Chicago, Illinois, United States|Baystate Critical Care Medicine / Tufts University School of Medicine, Springfield, Massachusetts, United States|University of Michigan, Ann Arbor, Michigan, United States|Wakeforest University, School of Medicine, Winston-Salem, North Carolina, United States|The Cleveland Clinic Foundation, Cleveland, Ohio, United States|Ohio State University Medical Center, Columbus, Ohio, United States|The Oregon Clinic, Portland, Oregon, United States|University of Pennsylvania Medical Center, Philadelphia, Pennsylvania, United States|University of Pittsburgh Medical Center, Pittsburgh, Pennsylvania, United States|University of Vermont College of Medicine, Burlington, Vermont, United States|University of Virginia, Charlottesville, Virginia, United States|Harborview Medical Center, Seattle, Washington, United States|University of Washington Medical Center / Harborview Medical Center, Seattle, Washington, United States","https://ClinicalTrials.gov/show/NCT01335932"
356,"Losartan for Patients With COVID-19 Requiring Hospitalization","Completed","Has Results","Corona Virus Infection|Acute Respiratory Distress Syndrome|SARS-CoV Infection","Drug: Losartan|Other: Placebo","All","18 Years and older   (Adult, Older Adult)","Phase 2","205","February 1, 2021","University of Florida Health Gainesville, Gainesville, Florida, United States|University of Florida Health Jacksonville, Jacksonville, Florida, United States|Grady Memorial Hospital, Atlanta, Georgia, United States|Henry Ford Hospital, Detroit, Michigan, United States|M Health Fairview Ridges Hospital, Burnsville, Minnesota, United States|M Health Fairview Southdale Hospital, Edina, Minnesota, United States|Hennepin County Medical Center, Minneapolis, Minnesota, United States|M Health Fairview University of Minnesota Medical Center, Minneapolis, Minnesota, United States|University of Minnesota, Minneapolis, Minnesota, United States|North Memorial Health Hospital, Robbinsdale, Minnesota, United States|University of Mississippi Medical Center, Jackson, Mississippi, United States|Cooper University Hospital, Camden, New Jersey, United States|University of Cincinnati Medical Center, Cincinnati, Ohio, United States","https://ClinicalTrials.gov/show/NCT04312009"
357,"Inhaled ZYESAMI™ (Aviptadil Acetate) for the Treatment of Severe COVID-19","Terminated","No Results Available","SARS-CoV 2|COVID|ARDS|ALI|Acute Lung Injury/Acute Respiratory Distress Syndrome (ARDS)|Dyspnea","Drug: ZYESAMI™ (aviptadil acetate)|Drug: Placebo|Device: Nebulized administration of ZYESAMI™ or Placebo","All","18 Years to 85 Years   (Adult, Older Adult)","Phase 2|Phase 3","144","December 31, 2021","St. Jude Medical Center, Fullerton, California, United States|University of California - Irvine, Irvine, California, United States|University of Miami Leonard M. Miller School of Medicine (UMMSM), Miami, Florida, United States|Advent Health Research Institute, Orlando, Florida, United States|Northwestern Medical Group, Winfield, Illinois, United States|University of Louisville Hospital, Louisville, Kentucky, United States|Great Plains Health, North Platte, Nebraska, United States|University Medical Center, Las Vegas, Nevada, United States|Holy Name Medical Center, Teaneck, New Jersey, United States|Kettering Health Network, Kettering, Ohio, United States|Doylestown Hospital, Doylestown, Pennsylvania, United States|Self Regional Healthcare, Greenwood, South Carolina, United States|University of Texas San Antonio Medical Arts and Research Center, San Antonio, Texas, United States","https://ClinicalTrials.gov/show/NCT04360096"
358,"Late Permissive Hypercapnia for Intubated and Ventilated Preterm Infants","Completed","No Results Available","Premature Neonate","Other: Higher permissive hypercapnia|Other: Lower Permissive Hypercapnia","All","7 Days to 14 Days   (Child)","Not Applicable","130","April 2021","UAB, Birmingham, Alabama, United States","https://ClinicalTrials.gov/show/NCT02799875"
359,"Inhaled Prostaglandin E1 (IPGE1) for Hypoxemic Respiratory Failure (NHRF)","Terminated","Has Results","Prematurity|Respiratory Insufficiency|Pulmonary Hypertension|Respiratory Distress Syndrome, Newborn","Drug: Aerosolized Normal Saline|Drug: Inhaled PGE1","All","up to 7 Days   (Child)","Phase 2","7","June 2012","University of Alabama at Birmingham, Birmingham, Alabama, United States|University of California - Los Angeles, Los Angeles, California, United States|Stanford University, Palo Alto, California, United States|University of Iowa, Iowa City, Iowa, United States|Wayne State University, Detroit, Michigan, United States|University of New Mexico, Albuquerque, New Mexico, United States|University of Rochester, Rochester, New York, United States|Duke University, Durham, North Carolina, United States|Research Institute at Nationwide Children's Hospital, Columbus, Ohio, United States|Brown University, Women & Infants Hospital of Rhode Island, Providence, Rhode Island, United States|University of Texas Southwestern Medical Center at Dallas, Dallas, Texas, United States","https://ClinicalTrials.gov/show/NCT01467076"
360,"Investigation of a New, Oral Growth Hormone Secretagogue, AEZS-130 as a Growth Hormone Stimulation Test.","Completed","Has Results","Diagnosis of Adult Growth Hormone Deficiency (AGDH)","Drug: AEZS-130 (formerly ARD-07)|Drug: L-ARG+GHRH","All","18 Years and older   (Adult, Older Adult)","Phase 3","101","July 2011","Celerion, Tempe, Arizona, United States|Cedars-Sinai Medical Center, Los Angeles, California, United States|Harbor-UCLA Medical Center, Torrance, California, United States|Northwestern University, Chicago, Illinois, United States|Radiant Research Inc., Chicago, Illinois, United States|John Hopkins University, Baltimore, Maryland, United States|Massachusetts General Hospital, Boston, Massachusetts, United States|Celerion, Lincoln, Nebraska, United States|Celerion, Neptune, New Jersey, United States|Oregon Health & Science University, Portland, Oregon, United States|Baylor College of Medicine, Houston, Texas, United States|Cetero Research, San Antonio, Texas, United States|VA Puget Sound HCS University of Washington, Tacoma, Washington, United States","https://ClinicalTrials.gov/show/NCT00448747"
361,"Trial II of Lung Protection With Azithromycin in the Preterm Infant","Completed","Has Results","Bronchopulmonary Dysplasia","Drug: Azithromycin|Drug: Placebo","All","up to 72 Hours   (Child)","Phase 2","220","June 2012","University of Kentucky Medical Center, Lexington, Kentucky, United States","https://ClinicalTrials.gov/show/NCT00319956"
362,"Mesenchymal Stromal Cells for COVID-19 and Viral Pneumonias","Recruiting","No Results Available","COVID-19 Pneumonia|Viral Pneumonia","Biological: Allogeneic Mesenchymal Stromal Cells","All","18 Years to 80 Years   (Adult, Older Adult)","Phase 1","10","May 4, 2023","Medical University of South Carolina, Charleston, South Carolina, United States","https://ClinicalTrials.gov/show/NCT05286255"
363,"Regional Lung Inflammation and Expansion in Mechanically Ventilated Patients - a PET/CT Study","Unknown status","No Results Available","Respiratory Failure",,"All","18 Years and older   (Adult, Older Adult)",,"10","March 2019","Massachusetts General Hospital, Boston, Massachusetts, United States","https://ClinicalTrials.gov/show/NCT01806532"
364,"Post-exposure Prophylaxis / Preemptive Therapy for SARS-Coronavirus-2","Completed","Has Results","Corona Virus Infection|Acute Respiratory Distress Syndrome|SARS-CoV Infection|Coronavirus|Coronavirus Infections","Drug: Hydroxychloroquine|Other: Placebo","All","18 Years and older   (Adult, Older Adult)","Phase 3","1312","May 20, 2020","Nationwide Enrollment via Internet, please email: covid19@umn.edu, Minneapolis, Minnesota, United States|University of Minnesota, Minneapolis, Minnesota, United States|University of Alberta, Edmonton, Alberta, Canada|University of Manitoba, Winnipeg, Manitoba, Canada|Research Institute of the McGill University Heath Centre, Montréal, Quebec, Canada","https://ClinicalTrials.gov/show/NCT04308668"
365,"Study of Therapeutic Exercise in Acute Respiratory Failure to Improve Neuromuscular Disability Trial","Completed","No Results Available","Critical Illness|Acute Respiratory Failure","Behavioral: Early mobilization intervention","All","18 Years and older   (Adult, Older Adult)","Not Applicable","1917","July 30, 2020","Hospital of the University of Pennsylvania, Philadelphia, Pennsylvania, United States|Penn Presbyterian Medical Center, Philadelphia, Pennsylvania, United States|Pennsylvania Hospital, Philadelphia, Pennsylvania, United States|Chester County Hospital, West Chester, Pennsylvania, United States","https://ClinicalTrials.gov/show/NCT03863470"
366,"Betamethasone Dosing Interval - 12 or 24 Hours?","Completed","No Results Available","Preterm Delivery","Drug: dosing of Betamethasone","Female","16 Years to 45 Years   (Child, Adult)","Not Applicable","200","October 2009","Cooper University Hospital, Camden, New Jersey, United States|Atlanticare Regional Medical Center, Pomona, New Jersey, United States","https://ClinicalTrials.gov/show/NCT00453141"
367,"Tocilizumab for Patients With Cancer and COVID-19 Disease","Terminated","Has Results","Hematopoietic and Lymphoid Cell Neoplasm|Malignant Solid Neoplasm|Pneumonia|Pneumonitis|Severe Acute Respiratory Distress Syndrome|Symptomatic COVID-19 Infection Laboratory-Confirmed","Biological: Tocilizumab","All","2 Years and older   (Child, Adult, Older Adult)","Phase 2","1","January 14, 2021","National Cancer Institute, Rockville, Maryland, United States|University Medical Center of Southern Nevada, Las Vegas, Nevada, United States|Summerlin Hospital Medical Center, Las Vegas, Nevada, United States|University of Oklahoma Health Sciences Center, Oklahoma City, Oklahoma, United States|Valley Medical Center, Renton, Washington, United States","https://ClinicalTrials.gov/show/NCT04370834"
